<?xml version="1.0" encoding="UTF-8"?>
<xsd:schema xmlns:xsd="http://www.w3.org/2001/XMLSchema"
            targetNamespace="http://www.sitemaps.org/schemas/sitemap/0.9"
            xmlns="http://www.sitemaps.org/schemas/sitemap/0.9"
            elementFormDefault="qualified">
  <xsd:annotation>
    <xsd:documentation>
      XML Schema for Sitemap files.
      Last Modifed 2008-03-26
    </xsd:documentation>
  </xsd:annotation>

  <xsd:element name="urlset" type="tUrlset"/>
  <xsd:complexType name="tUrlset">
    <xsd:sequence>
      <xsd:element name="url" type="tUrl" maxOccurs="unbounded"/>
    </xsd:sequence>
  </xsd:complexType>

  <xsd:complexType name="tUrl">
    <xsd:all>
      <xsd:element name="loc" type="tLoc"/>
      <xsd:element name="lastmod" type="tLastmod" minOccurs="0"/>
      <xsd:element name="changefreq" type="tChangeFreq" minOccurs="0"/>
      <xsd:element name="priority" type="tPriority" minOccurs="0"/>
    </xsd:all>
  </xsd:complexType>

  <xsd:simpleType name="tLoc">
    <xsd:restriction base="xsd:anyURI">
      <xsd:minLength value="1"/>
      <xsd:maxLength value="2048"/>
    </xsd:restriction>
  </xsd:simpleType>

  <xsd:simpleType name="tLastmod">
    <xsd:restriction base="xsd:string">
      <xsd:minLength value="1"/>
      <xsd:maxLength value="50"/>
    </xsd:restriction>
  </xsd:simpleType>

  <xsd:simpleType name="tChangeFreq">
    <xsd:restriction base="xsd:string">
      <xsd:enumeration value="always"/>
      <xsd:enumeration value="hourly"/>
      <xsd:enumeration value="daily"/>
      <xsd:enumeration value="weekly"/>
      <xsd:enumeration value="monthly"/>
      <xsd:enumeration value="yearly"/>
      <xsd:enumeration value="never"/>
    </xsd:restriction>
  </xsd:simpleType>

  <xsd:simpleType name="tPriority">
    <xsd:restriction base="xsd:decimal">
      <xsd:minInclusive value="0.0"/>
      <xsd:maxInclusive value="1.0"/>
    </xsd:restriction>
  </xsd:simpleType>
</xsd:schema>
