<?xml version="1.0" encoding="UTF-8"?>
<urlset xmlns="http://www.sitemaps.org/schemas/sitemap/0.9"
        xmlns:xsi="http://www.w3.org/2001/XMLSchema-instance"
        xsi:schemaLocation="http://www.sitemaps.org/schemas/sitemap/0.9 sitemap.xsd">
  <url>
    <loc>https://arcadiaphotography.replit.app/</loc>
    <lastmod>2025-07-23</lastmod>
    <changefreq>weekly</changefreq>
    <priority>1.0</priority>
  </url>
  <url>
    <loc>https://arcadiaphotography.replit.app/portfolio</loc>
    <lastmod>2025-07-23</lastmod>
    <changefreq>weekly</changefreq>
    <priority>0.8</priority>
  </url>
  <url>
    <loc>https://arcadiaphotography.replit.app/services</loc>
    <lastmod>2025-07-23</lastmod>
    <changefreq>monthly</changefreq>
    <priority>0.8</priority>
  </url>
  <url>
    <loc>https://arcadiaphotography.replit.app/contact</loc>
    <lastmod>2025-07-23</lastmod>
    <changefreq>monthly</changefreq>
    <priority>0.7</priority>
  </url>
  <url>
    <loc>https://arcadiaphotography.replit.app/about</loc>
    <lastmod>2025-07-23</lastmod>
    <changefreq>monthly</changefreq>
    <priority>0.7</priority>
  </url>
  <url>
    <loc>https://arcadiaphotography.replit.app/wedding-photography</loc>
    <lastmod>2025-07-23</lastmod>
    <changefreq>monthly</changefreq>
    <priority>0.8</priority>
  </url>
  <url>
    <loc>https://arcadiaphotography.replit.app/family-photography</loc>
    <lastmod>2025-07-23</lastmod>
    <changefreq>monthly</changefreq>
    <priority>0.8</priority>
  </url>
  <url>
    <loc>https://arcadiaphotography.replit.app/real-estate-photography</loc>
    <lastmod>2025-07-23</lastmod>
    <changefreq>monthly</changefreq>
    <priority>0.8</priority>
  </url>
  <url>
    <loc>https://arcadiaphotography.replit.app/privacy-policy</loc>
    <lastmod>2025-07-23</lastmod>
    <changefreq>yearly</changefreq>
    <priority>0.3</priority>
  </url>
  <url>
    <loc>https://arcadiaphotography.replit.app/terms-of-service</loc>
    <lastmod>2025-07-23</lastmod>
    <changefreq>yearly</changefreq>
    <priority>0.3</priority>
  </url>
</urlset>
